{
  "id": "e0912d46-cded-4757-9367-2d8b3f81693f",
  "version": 1,
  "total_version_count": 4,
  "edit_requests": [
    {
      "id": "d3a1f270-9037-4782-8e73-462e2e0b7340",
      "edit_instruction": {
        "requestedInstructions": [
          {
            "start_of_cut": "00:00:01",
            "end_of_cut": "00:00:02",
            "reason": "test",
            "start": 1,
            "end": 2
          },
          {
            "start_of_cut": "00:03:00",
            "end_of_cut": "00:05:00",
            "reason": "Removing 2 minutes",
            "start": 180,
            "end": 300
          }
        ],
        "ffmpegInstructions": [
          {
            "start": 0,
            "end": 1
          },
          {
            "start": 2,
            "end": 180
          },
          {
            "start": 300,
            "end": 733
          }
        ]
      },
      "status": "DRAFT",
      "created_by_id": "c56e379e-88cc-417c-801a-8647b82825c9",
      "created_by": "Lydia Ralph (DEV)",
      "created_at": "2026-02-27T14:25:31.228Z",
      "modified_at": "2026-02-27T14:25:31.223Z"
    },
    {
      "id": "91746e31-5d54-4b94-9b5e-61df2637c108",
      "edit_instruction": {
        "requestedInstructions": [
          {
            "start_of_cut": "00:00:01",
            "end_of_cut": "00:00:02",
            "reason": "test",
            "start": 1,
            "end": 2
          },
          {
            "start_of_cut": "00:03:00",
            "end_of_cut": "00:05:00",
            "reason": "Removing 2 minutes",
            "start": 180,
            "end": 300
          }
        ],
        "ffmpegInstructions": [
          {
            "start": 0,
            "end": 1
          },
          {
            "start": 2,
            "end": 180
          },
          {
            "start": 300,
            "end": 733
          }
        ]
      },
      "status": "DRAFT",
      "created_by_id": "c56e379e-88cc-417c-801a-8647b82825c9",
      "created_by": "Lydia Ralph (DEV)",
      "created_at": "2026-02-27T14:25:13.784Z",
      "modified_at": "2026-02-27T14:25:13.773Z"
    },
    {
      "id": "f264f9cb-0203-4fa6-9234-b6efec06819e",
      "edit_instruction": {
        "requestedInstructions": [
          {
            "start_of_cut": "00:03:00",
            "end_of_cut": "00:05:00",
            "reason": "Removing 2 minutes",
            "start": 180,
            "end": 300
          }
        ],
        "ffmpegInstructions": [
          {
            "start": 0,
            "end": 180
          },
          {
            "start": 300,
            "end": 733
          }
        ]
      },
      "status": "COMPLETE",
      "started_at": "2026-02-24T10:40:36.066Z",
      "finished_at": "2026-02-24T10:42:39.851Z",
      "created_by_id": "8da77965-acec-4256-b695-509924a11f06",
      "created_by": "Komal Dabhi (DEV)",
      "created_at": "2026-02-24T10:39:01.665Z",
      "modified_at": "2026-02-24T10:42:40.050Z"
    },
    {
      "id": "aa5e4e2f-0169-48af-a084-5f4cb00d2ec9",
      "edit_instruction": {
        "requestedInstructions": [
          {
            "start_of_cut": "00:05:00",
            "end_of_cut": "00:07:59",
            "reason": "Removing almost 3 minutes",
            "start": 300,
            "end": 479
          }
        ],
        "ffmpegInstructions": [
          {
            "start": 0,
            "end": 300
          },
          {
            "start": 479,
            "end": 733
          }
        ]
      },
      "status": "COMPLETE",
      "started_at": "2025-12-15T13:30:37.154Z",
      "finished_at": "2025-12-15T13:32:22.546Z",
      "created_by_id": "8da77965-acec-4256-b695-509924a11f06",
      "created_by": "Komal Dabhi (DEV)",
      "created_at": "2025-12-15T13:27:36.640Z",
      "modified_at": "2025-12-18T12:05:52.098Z"
    },
    {
      "id": "0d71a6de-7db0-4e04-8611-f288d7e26a7d",
      "edit_instruction": {
        "requestedInstructions": [
          {
            "start_of_cut": "00:00:00",
            "end_of_cut": "00:01:00",
            "reason": "I don’t want this",
            "start": 0,
            "end": 60
          },
          {
            "start_of_cut": "00:01:01",
            "end_of_cut": "00:02:00",
            "reason": "",
            "start": 61,
            "end": 120
          }
        ],
        "ffmpegInstructions": [
          {
            "start": 60,
            "end": 61
          },
          {
            "start": 120,
            "end": 733
          }
        ]
      },
      "status": "PROCESSING",
      "started_at": "2025-12-15T10:11:22.530Z",
      "created_by_id": "c56e379e-88cc-417c-801a-8647b82825c9",
      "created_by": "Lydia Ralph (DEV)",
      "created_at": "2025-12-15T10:09:20.579Z",
      "modified_at": "2025-12-15T10:11:22.544Z"
    }
  ],
  "edit_status": "DRAFT",
  "capture_session": {
    "id": "2a6d504d-2c72-4f18-aad4-d08505caa304",
    "booking_id": "9e823ccb-cb20-43ba-a430-56dbc6190b7c",
    "origin": "PRE",
    "ingest_address": "rtmps://in-2c40ef17-caa6-4caf-8268-775ab8c49e3d.uksouth.streaming.mediakind.com:2935/1ccdd12f-7114-4315-9b1e-243bd721cba2",
    "live_output_url": "https://ep-default-live-pre-mediakind-stg.uksouth.streaming.mediakind.com/2a6d504d2c724f18aad4d08505caa304/index.qfm/manifest(format=m3u8-cmaf)",
    "started_at": "2025-06-26T10:01:37.688Z",
    "started_by_user_id": "8da77965-acec-4256-b695-509924a11f06",
    "finished_at": "2025-06-26T10:20:34.489Z",
    "finished_by_user_id": "8da77965-acec-4256-b695-509924a11f06",
    "status": "RECORDING_AVAILABLE",
    "court_name": "102 Petty France",
    "case_state": "OPEN"
  },
  "filename": "2a6d504d2c724f18aad4d08505caa304_1280x720_4500k.mp4",
  "duration": "PT12M13.5S",
  "created_at": "2025-06-26T10:23:23.276Z",
  "case_id": "368bc646-32eb-4e3a-9af3-aeac32f86630",
  "case_reference": "TEST-NO-2",
  "is_test_case": false,
  "participants": [
    {
      "id": "d863d7b5-63e4-4fad-b80c-6fe1848191c4",
      "participant_type": "DEFENDANT",
      "first_name": "Komal",
      "last_name": "Dabhi",
      "created_at": "2025-06-26T10:00:17.576Z",
      "modified_at": "2025-06-26T10:00:17.556Z"
    },
    {
      "id": "eb518f93-9db5-40eb-a538-ac95df9a5b9a",
      "participant_type": "WITNESS",
      "first_name": "Simon",
      "last_name": "",
      "created_at": "2025-06-26T10:00:17.567Z",
      "modified_at": "2025-06-26T10:00:17.549Z"
    }
  ]
}
